{
  "schema_version": "1.0.0",
  "review_id": "REV-OPS-R17-001",
  "route_key": "RV-OPS-R17",
  "review_utc": "2026-09-18T13:49:26Z",
  "object_id": "1hBph5Fpxd5dVrolNkvzU8nb7xpxUiUdc",
  "object_title": "OP-PROT-019-v1.1_R17.md",
  "object_bytes": 14073,
  "object_sha256": "04987ba47b58be623a3b2a5a8a21236f43d4393cc04009e87f4a62b59a787390",
  "extraction_rule": "Drive file ID 1hBph5Fpxd5dVrolNkvzU8nb7xpxUiUdc, mimeType text/markdown. Not a native Google Doc, so R17 §2's revision-aware export requirement does not apply and no exportMimeType was passed: mcp__Google_Drive__download_file_content returned {\"content\": <base64>}, which was base64-decoded to raw bytes and hashed with no newline, BOM or Unicode normalization of any kind. The 14,073 decoded bytes were written to disk and sha256sum-ed as a file, not hashed in memory only.",
  "obtained": true,
  "obtained_how": "Resolved the route's Packet/source link through `python3 tools/drive_index.py id 1hBph5Fpxd5dVrolNkvzU8nb7xpxUiUdc`, cross-checked by `tools/drive_index.py sha 04987ba4...`, then downloaded the file itself with the Drive MCP connector and decoded it locally. My own computed digest is 04987ba47b58be623a3b2a5a8a21236f43d4393cc04009e87f4a62b59a787390 over 14,073 bytes, which agrees exactly with the Body SHA-256 and Body bytes the RV-OPS-R17 row of registers/json/review_queue.json carries. The three bundled evidence members named below were obtained separately, by the route described in finding OBJ-10.",
  "reviewer_family": "anthropic",
  "reviewer_session": "session_01Cz7WZybv8znP64SpPj6sWY (Claude Opus 5, Claude Code, repository /home/user/main, branch claude/drive-audit-github-migration-rrglpp)",
  "author_family": "openai",
  "author_family_determination": "From the 'Author / provider' column of the RV-OPS-R17 row of registers/json/review_queue.json, which reads 'OpenAI / OPS4-20260917-b9c2'. Corroborated inside the carrier bundle by 00_HANDOFF_SUMMARY_OPS4.json, whose payload names task_id 'DQ-OPS4-20260917-b9c2' and claim_id 'CLAIM-OPS4-20260917-b9c2' and whose sole declared source is this exact object by Drive ID, digest and byte count; and by OP-PROT-012 §2, which fixes the attribution line 'ChatGPT under Dylan Roy's Autonomous Drive Architecture Directive'. The author family is therefore NOT this reviewer's family. That fact does not by itself license any credit; see independence_reason.",
  "exposure_disclosure": "Heavy and disqualifying for independence purposes; stated in full because a thin disclosure would make this record worthless.\n\n(1) Before opening a single byte of the object I had read the repository's own port of it at governance/protocols/OP-PROT-019-v1.1_R17.md, in full. That port is a derived copy of this very object (see finding OBJ-01), so I came to the exact bytes already knowing the document's whole argument, section by section.\n\n(2) I had read docs/R17_IMPLEMENTATION_REPORT.md, the author-side installation report, which states the conclusions I was asked to test: that thirteen adversarial test groups passed under normal and optimized Python, that R17 'replaces the proposed guarantees with precise behavior', and that 'Sheets coordination remains cooperative rather than race-free'. I had therefore seen the author's own summary of the result before reconstructing anything, which is exactly the access OP-PROT-012 §5(c) forbids to an independent-eyes reviewer.\n\n(3) I had read governance/GIT_ADAPTATION.md, including the publication-race row I was separately asked to challenge, and OP-PROT-012 in full.\n\n(4) I had read the README, docs/RESEARCH_MAP.md section headings and docs/OPEN_PROBLEMS.md sections D, E and F, so I knew before starting that this route is one of 24, that it is one of only three at technical status READY (RV-RN3, RV-P15, RV-OPS-R17), that docs/OPEN_PROBLEMS.md §D describes all 24 as unassigned — a claim I later found to be off by one, see finding OBJ-13, and that section F already reports three Quarantine Index rows using an EXISTING_CONTAINER class that OP-PROT-019 §6 does not define. That last item is a pre-existing repository finding, not mine; my Case 4 probe rediscovered the same gap from the implementation side, and I have labelled it as corroboration rather than as a new finding.\n\n(5) I had read reviews/README.md and reviews/SCHEMA.md, which quote R17 §4 verbatim and argue five places where the protocol and the contribution plan's summary differ. Those quotations primed me on §4's wording before I read §4 in the object.\n\n(6) Lineage exposure, the most serious item. This session belongs to the same Anthropic lineage that produced this repository's port of the object, the ported implementation report, GIT_ADAPTATION.md, OPEN_PROBLEMS.md and the review-record schema I am writing into. I am not a coauthor of the Drive object, whose author lineage is OpenAI, but I am downstream of an Anthropic re-expression of it and I reused that re-expression as my entry point.\n\n(7) What I had NOT seen before this review, and what therefore carries more weight: r17_reference.py, test_r17_reference.py, TESTS_NORMAL.txt, TESTS_OPTIMIZED.txt and 00_HANDOFF_SUMMARY_OPS4.json. None of those five is reproduced anywhere in this repository; I obtained and digest-verified all five during this review and had no prior sight of any of them.\n\n(8) Bias direction. Reading the author's favourable report first biases toward agreement, and I did in fact confirm its headline claim. The counterweight I applied is that every adverse finding below was produced by executing something, not by reading, and each is reproducible from the commands in the Markdown companion.",
  "hypotheses": [
    "Operator authorization is not evidence: 'Dylan Roy directly authorized this overhaul... This authorization is not a proof, an independence credit, or approval of an unresolved theorem.' Every rule below inherits that disclaimer.",
    "Concurrency is cooperative, not transactional: 'Sheets batch updates are atomic within one request, **not a compare-and-swap lock across clients**... This is cooperative coordination, not a hard distributed mutex.'",
    "Ordering by append position holds only if all contenders append: 'Legacy Active Work Claims and advisory lanes remain collision inputs during migration; do not declare a known live older claim absent just because it is not in Work Events.'",
    "No hard lock is installed: 'If a strict machine-enforced lock is required, a transaction-capable service is still needed; none is represented as installed here.'",
    "Inventory completeness is unprovable through this connector: 'This connector does not expose a Drive changes cursor. A modified-time search can miss removals or access loss, so it cannot certify global completeness.'",
    "Identity is the exact digest, never the timestamp or the title: 'Native Docs require revision-aware extraction; Drive modifiedTime alone is not a body digest'; 'The digest establishes identity, not truth or authorization.'",
    "Independence is a separate dimension from correctness: 'Same provider is **zero organizational independence**, not a prohibition on useful technical review. Different provider alone does not establish independence if it coauthored the target or reused the same reasoning.'",
    "A technical pass is never terminal on its own: 'A task may finish its technical review while an external-independence predicate remains open. Never relabel an independence-required theorem terminal solely because its technical review passed.'",
    "Age is prioritisation only: 'Never turn age into automatic approval, invalidation, or extra independence.'",
    "The decisive scope hypothesis on the accompanying code: 'The accompanying local reference validator and adversarial tests demonstrate protocol predicates on specified inputs. They are not a deployed enforcement service and do not prove race freedom for Google Drive.' Every claim about the bundled code is conditional on 'on specified inputs'."
  ],